Ticker,Title,Published,Sentiment,Sentiment Score,Summary,Source,Source_domain,URL,Full_Article
AAPL,Apple  ( AAPL )  Stock Moves -0.99%: What You Should Know,20250326,Neutral,0.087162,"Apple (AAPL) closed the most recent trading day at $221.53, moving -0.99% from the previous trading session.",Zacks Commentary,www.zacks.com,https://www.zacks.com/stock/news/2435844/apple-aapl-stock-moves--099-what-you-should-know,
AAPL,Meta Is Paying 'Way Above Market Rate' For Reality Labs Developers As Metaverse Losses Mount - Meta Platforms  ( NASDAQ:META ) ,20250326,Neutral,0.108467,"Meta is luring in VR programmers with ""unusually high"" salaries ranging from $600,000 to $1 million. ""It's not an exaggeration to say that their total compensation is double or more than double of what you'll get at a large gaming company."" Pelosi's latest AI pick skyrocketed 169% in just one ...",Benzinga,www.benzinga.com,https://www.benzinga.com/general/gaming/25/03/40399305/dont-forget-about-the-metaverse-average-meta-vr-developer-salary-is-more-than-typical-american-mak,"Benzinga Rankings give you vital metrics on any stock – anytime.
Meta Platforms Inc META shares came under pressure in 2022 due to cost concerns after the company rebranded from Facebook and laid out a new vision for the future focused on the metaverse. The stock has regained momentum over the past couple of years, surging to new highs as the company leaned into AI.
Although Meta’s metaverse ambitions are not currently in focus for the Street, Meta continues to develop virtual reality and augmented reality technologies needed to bring the metaverse idea to consumers. Meta reported operating losses for Reality Labs of approximately $5 billion last quarter. The company continues to attract VR employees with outrageous salaries. 
What To Know: According to a Washington Post report citing people familiar with the matter, Meta is paying programmers capable of creating virtual reality-related tech abnormally high amounts ranging from $600,000 to nearly $1 million annually. 
Meta is paying “significantly more” than most other gaming companies, according to Patrick McAdams, CEO of Andiamo, a data-driven tech recruiting firm.
“It's not an exaggeration to say that their total compensation is double or more than double of what you'll get at a large gaming company,” McAdams said.
Meta spent approximately $10 billion on its metaverse build out in 2021, another $15.9 billion for its Reality Labs division in 2022, another $16 billion in 2023 and approximately $17.7 billion last year. 
Why It Matters: It appears a significant portion of its metaverse and VR spending is going toward offering eye-popping pay packages to programmers. The report indicates that Meta is willing to pay “unusually high salaries” in order to get the best developers to work for the company instead of for competitors. 
A former recruiter for the Mark Zuckerberg-led company told the Washington Post that there usually wasn’t much competition on the offers they made because they would “pay way above market rate” for several roles. 
See Also: Mark Zuckerberg Faces Backlash Over Plans To Let Children Access Metaverse
Of all the VR developers that were offered jobs at Meta in recent years, the average compensation was nearly $540,000. For comparison, Apple Inc’s AAPL highest pay packages for VR developers were a little below $500,000 and Alphabet Inc GOOG reportedly paid its top-tier developers approximately $440,000. 
One executive from a smaller gaming company said he was unable to hire a senior developer last year because Meta had offered the candidate $800,000 per year with a performance bonus that could see total compensation rise to about $1 million. 
“This candidate was a senior [developer who didn't have] super unique experience [or] skills. Facebook was doing pretty wild stuff a year ago,” the executive reportedly said.
META Price Action: Meta shares are up approximately 6.65% since the start of 2025, according to Benzinga Pro.
Read Next:
Photo: Shutterstock / Some elements of this story were previously reported by Benzinga and it has been updated.
Benzinga Rankings give you vital metrics on any stock – anytime.
© 2025 Benzinga.com. Benzinga does not provide investment advice. All rights reserved.
Trade confidently with insights and alerts from analyst ratings, free reports and breaking news that affects the stocks you care about."
AAPL,These 3 Companies are Cash Generating Machines,20250326,Somewhat-bullish,0.345548,"Strong cash flows reflect financial stability, enabling companies to eliminate debt, pursue growth opportunities, and distribute dividend payments, among other positive features.",Zacks Commentary,www.zacks.com,https://www.zacks.com/commentary/2435179/these-3-companies-are-cash-generating-machines,
AAPL,"Insights Into Apple's Performance Versus Peers In Technology Hardware, Storage & Peripherals Sector - Apple  ( NASDAQ:AAPL ) ",20250326,Somewhat-bullish,0.276249,"Amidst the fast-paced and highly competitive business environment of today, conducting comprehensive company analysis is essential for investors and industry enthusiasts.",Benzinga,www.benzinga.com,https://www.benzinga.com/insights/news/25/03/44496034/insights-into-apples-performance-versus-peers-in-technology-hardware-storage-amp-peripherals-sector,"Benzinga Rankings give you vital metrics on any stock – anytime.
Amidst the fast-paced and highly competitive business environment of today, conducting comprehensive company analysis is essential for investors and industry enthusiasts. In this article, we will delve into an extensive industry comparison, evaluating Apple AAPL in comparison to its major competitors within the Technology Hardware, Storage & Peripherals industry. By analyzing critical financial metrics, market position, and growth potential, our objective is to provide valuable insights for investors and offer a deeper understanding of company's performance in the industry.
Apple is among the largest companies in the world, with a broad portfolio of hardware and software products targeted at consumers and businesses. Apple's iPhone makes up a majority of the firm sales, and Apple's other products like Mac, iPad, and Watch are designed around the iPhone as the focal point of an expansive software ecosystem. Apple has progressively worked to add new applications, like streaming video, subscription bundles, and augmented reality. The firm designs its own software and semiconductors while working with subcontractors like Foxconn and TSMC to build its products and chips. Slightly less than half of Apple's sales come directly through its flagship stores, with a majority of sales coming indirectly through partnerships and distribution.
When closely examining Apple, the following trends emerge: 
At 35.52, the stock's Price to Earnings ratio significantly exceeds the industry average by 1.05x, suggesting a premium valuation relative to industry peers.
The elevated Price to Book ratio of 50.35 relative to the industry average by 9.41x suggests company might be overvalued based on its book value.
The Price to Sales ratio of 8.65, which is 5.12x the industry average, suggests the stock could potentially be overvalued in relation to its sales performance compared to its peers.
The company has a higher Return on Equity (ROE) of 58.74%, which is 50.21% above the industry average. This suggests efficient use of equity to generate profits and demonstrates profitability and growth potential.
The company exhibits higher Earnings Before Interest, Taxes, Depreciation, and Amortization (EBITDA) of $45.91 Billion, which is 117.72x above the industry average, implying stronger profitability and robust cash flow generation.
With higher gross profit of $58.27 Billion, which indicates 73.76x above the industry average, the company demonstrates stronger profitability and higher earnings from its core operations.
The company is witnessing a substantial decline in revenue growth, with a rate of 3.95% compared to the industry average of 21.47%, which indicates a challenging sales environment.

The debt-to-equity (D/E) ratio is an important measure to assess the financial structure and risk profile of a company.
Considering the debt-to-equity ratio in industry comparisons allows for a concise evaluation of a company's financial health and risk profile, aiding in informed decision-making.
When comparing Apple with its top 4 peers based on the Debt-to-Equity ratio, the following insights can be observed:
Compared to its top 4 peers, Apple has a moderate debt-to-equity ratio of 1.45, indicating a balanced financial structure.
This suggests that the company maintains a reasonable level of debt while also leveraging equity financing.
For Apple in the Technology Hardware, Storage & Peripherals industry, the PE, PB, and PS ratios are all high compared to its peers, indicating that the stock may be overvalued. On the other hand, Apple's high ROE, EBITDA, gross profit, and low revenue growth suggest strong profitability and operational efficiency relative to its industry competitors.
This article was generated by Benzinga's automated content engine and reviewed by an editor.
Benzinga Rankings give you vital metrics on any stock – anytime.
© 2025 Benzinga.com. Benzinga does not provide investment advice. All rights reserved.
Trade confidently with insights and alerts from analyst ratings, free reports and breaking news that affects the stocks you care about."
AAPL,"The Zacks Analyst Blog Highlights Apple, Alphabet, Garmin and Meta",20250326,Somewhat-bullish,0.281319,"Apple, Alphabet, Garmin and Meta are part of the Zacks top Analyst Blog.",Zacks Commentary,www.zacks.com,https://www.zacks.com/stock/news/2435683/the-zacks-analyst-blog-highlights-apple-alphabet-garmin-and-meta,
AAPL,How To Trade The Top Tech Stocks Today?,20250326,Somewhat-bullish,0.182323,"Good Morning Traders! In today's Market Clubhouse Morning Memo, we will discuss SPY, QQQ, AAPL, MSFT, NVDA, GOOGL, META, and TSLA. Our proprietary formula, exclusive to Market Clubhouse, dictates these price levels. This dynamic equation takes into account price, volume, and options flow.",Benzinga,www.benzinga.com,https://www.benzinga.com/etfs/broad-u-s-equity-etfs/25/03/44494690/how-to-trade-the-top-tech-stocks-today,"Good Morning Traders! In today’s Market Clubhouse Morning Memo, we will discuss SPY, QQQ, AAPL, MSFT, NVDA, GOOGL, META, and TSLA.
Our proprietary formula, exclusive to Market Clubhouse, dictates these price levels. This dynamic equation takes into account price, volume, and options flow. These levels are updated every day and shared with all Clubhouse Members, prior to the opening of the market.
We recommend closely monitoring these stocks, and be prepared to leverage potential breakouts or reversals. As always, stay alert and ready to adjust your tactics based on the market’s pulse to optimize your trading gains. Now, let’s dive into the stock analysis:
SPDR S&P 500 ETF Trust (SPY)
The SPY is currently trading near our pivotal mark of 574.65. Buyers must initially push prices above 575.67 to demonstrate momentum. If buying persists above this area, expect bulls to challenge the next critical zone at 576.62. Maintaining strength at 576.62 through the trading session could propel SPY upward, targeting resistance at 577.87. Our top bullish goal today for SPY is set at 579.12.
Should 574.65 fail as support, sellers will aim lower, challenging 573.50 to test bullish commitment. A breach here would likely accelerate bearish action, driving price toward 572.15. Persistent selling momentum beneath this level would next target the critical support at 571.06. On a particularly aggressive selling day, SPY could reach our ultimate bearish objective of 569.98.
Invesco QQQ Trust Series 1 (QQQ)
The QQQ is presently hovering around our essential price of 493.60. Bulls need to maintain and stabilize price action here, pushing higher to reclaim 495.35 decisively. If successful, bullish traders could drive prices upward to challenge 496.94 next. With sustained buying strength, further gains toward 498.37 become likely, putting our peak bullish target for today at 499.44 within reach.
If bulls fail to defend 493.60 intraday, expect bearish pressure to quickly drive prices toward the downside level at 491.82. Continued weakness could extend declines to 490.05, with further aggressive selling potentially targeting support at 487.69. A failure to stabilize here could cause prices to tumble further toward our low bearish target today at 486.10.
Apple Inc. (AAPL)
Apple is currently trading close to our crucial pivot at 223.87. Buyers must secure this as reliable support, creating momentum toward the next upside target at 225.31. Should bullish participants continue to dominate price action, Apple shares could advance further to test 226.08. If momentum remains robust throughout the session, expect Apple to challenge our primary bullish target today at 226.90.
If price action fails to maintain 223.87 intraday, selling pressure will likely push Apple lower, initially targeting 222.96. Continued weakness would encourage bearish traders to seek further downside toward 222.24. If selling pressure persists below this area, expect Apple to test support at 221.66, potentially falling further toward today’s lower bearish target at 220.97.
Microsoft Corp. (MSFT)
Microsoft is currently navigating around our key intraday level of 394.46. Bullish momentum must emerge above this level, lifting the price to test the next significant zone at 395.68, which bulls must maintain decisively as support. Achieving stability here could generate a continued upward move to challenge 397.65. With sustained bullish engagement, Microsoft could reach today’s bullish target of 398.38.
If Microsoft falters at 394.46, sellers will likely apply pressure, testing support at 393.47. A clear breakdown below this area would indicate weakening momentum, targeting lower levels at 392.49. If bears gain stronger momentum, price action might extend declines toward 390.98, with our bottom bearish objective today established at 389.29.
NVIDIA Corporation (NVDA)
NVIDIA currently trades around our crucial mark of 119.44. Bulls must rapidly advance the price to test and reclaim support at 120.27. Successful bullish action here could fuel a drive higher, targeting 121.97 next. Continued strong buying throughout today’s session could carry NVIDIA toward further resistance at 123.41, ultimately approaching our high bullish goal today of 125.21.
Should NVIDIA fail to maintain stability at 119.44, bears will press the price downward, initially targeting 117.86. Continued selling below this level could further weaken the market, leading NVIDIA toward support at 116.61. Persistent downside action may extend toward 115.83, with an aggressive bearish scenario placing today’s lowest target at 115.15.
Alphabet Inc Class A (GOOGL)
Alphabet is currently trading around our crucial pivot of 169.34. Bulls need to firmly hold this level to build upward momentum toward 171.14. Sustained bullish activity here could propel Alphabet’s price toward our primary bullish target for the session at 172.28.
A failure at 169.34 during today's trading would trigger bearish momentum, driving Alphabet initially toward 167.04. Increased selling could lead to further downside action toward 165.41. Persistent bearish strength could ultimately push Alphabet toward our lowest bearish target today at 163.79.
Meta Platforms Inc (META)
Meta is presently positioned around our important intraday level of 629.88. Buyers need to establish firm support here, launching price action toward 635.49. Sustained buying activity could further elevate Meta shares toward 642.59. Continued bullish conviction today would enable traders to push prices toward our ultimate bullish target at 646.48.
Should Meta fail to secure 629.88 as intraday support, sellers will target the lower support at 622.01. Continued bearish activity could further pressure price toward 615.65. In the event of sustained selling intensity, bears may ultimately drive prices down to today’s bearish target at 609.30.
Tesla Inc. (TSLA)
Tesla is currently trading around our significant pivot level of 283.95. Bulls should actively push price above this zone to initially challenge 286.34. With ongoing bullish activity, price momentum could reach higher resistance at 288.80. If overall market strength remains supportive, Tesla may extend its rally toward 290.47. Exceptional bullish interest could propel prices to our upper bullish objective for Tesla today at 293.21.
If bulls are unable to secure 283.95 as firm support, anticipate bearish traders driving Tesla toward lower levels starting at 281.32. Continued bearish pressure would likely encourage further selling toward 279.43. A clear breakdown below this support could result in aggressive selling, ultimately targeting our lowest bearish objective for Tesla today at 278.11.
Final Word:
Today's economic calendar is relatively sparse but still noteworthy. At 8:30 AM ET, markets receive the Preliminary Durable Goods Orders and Preliminary Capital Goods Orders data for February, providing insight into the underlying health of the manufacturing and industrial sectors. Additionally, the U.S. Treasury will conduct auctions at 11:30 AM ET for the 2-Year Floating Rate Notes, followed by the 5-Year FRN auction at 1 PM ET. Traders should also pay attention to scheduled Federal Reserve commentary, starting with non-voter Kashkari at 10 AM ET, and more significantly, voting member Musalem at 1:10 PM ET, whose remarks could influence market perceptions on the Fed's future policy stance.
Given these events, traders should anticipate volatility during auction windows and Federal Reserve commentary, adjusting risk accordingly. Manage positions carefully, remain disciplined, and ensure proper risk protocols are followed. Good luck trading today!
The Morning Memo is curated by RIPS, a pro trader with years of experience in equities, options, and futures trading. RIPS is at the heart of the exclusive Market Clubhouse community, offering his insights, expertise, and real-time mentorship.
Start your day with a live daily market analysis, a carefully selected watch list, early access to the Morning Memo, and exclusive Market Clubhouse price levels, providing precise support and resistance indicators. When you become a member of Market Clubhouse, you will gain early access to the Morning Memo, just like this one, every single day—hours before it’s published. You will also have access to a live stream with zero latency and screen sharing, enabling you to witness Rips executing his trades in real-time and sharing his exclusive trading plans, strategies, and live decision-making.
For a limited time during our special promotion, you can join RIPS and get a full access pass to Market Clubhouse for 7 full days for just $7. Check it out at https://marketclubhouse.club/7Days/ where you can trade live with him and tap into his wealth of knowledge and experience. You can also catch Rips on his live day trading streams every Monday-Friday at 8 am EST on the Market Clubhouse YouTube channel: https://www.youtube.com/@MarketClubhouse.
© 2025 Benzinga.com. Benzinga does not provide investment advice. All rights reserved.
Trade confidently with insights and alerts from analyst ratings, free reports and breaking news that affects the stocks you care about."
AAPL,"Stock Market News For Mar 26, 2025",20250326,Neutral,0.078153,"U.S. stocks ended higher on Tuesday on optimism that President Donald Trump's reciprocal tariffs, which go into effect from April 2, will be less aggressive than previously expected.",Zacks Commentary,www.zacks.com,https://www.zacks.com/stock/news/2435394/stock-market-news-for-mar-26-2025,
AAPL,"Alibaba, BMW Team Up To Bring AI-Powered Smart Assistant In Next-Gen China Cars - Alibaba Gr Hldgs  ( NYSE:BABA ) ",20250326,Somewhat-bullish,0.271142,"Alibaba and BMW to co-develop AI assistant using Qwen LLM for Neue Klasse models, launching in China in 2026. New AI-powered BMW assistant will offer voice commands, trip planning, and real-time suggestions like parking and dining. Feel unsure about the market's next move?",Benzinga,www.benzinga.com,https://www.benzinga.com/25/03/44492590/alibaba-and-bmw-team-up-to-bring-ai-powered-smart-assistant-to-next-gen-cars-in-china,"Alibaba Group Holding BABA and Bayerische Motoren Werke AG BMWKY announced an expanded strategic partnership in China on Wednesday. The companies proposed accelerating the integration of Alibaba’s Qwen large language model (LLM) into BMW’s next-generation intelligent vehicles, the Neue Klasse models.
The new BMW Intelligent Personal Assistant (IPA) will integrate a bespoke AI engine co-developed by the companies, Alizila reports.
Also Read: Alibaba Unveils New AI-Powered App With Chatbot, Image Generation, And Task Automation
The AI engine will be based on the Yan AI, a Qwen-empowered smart cockpit AI solution developed by Banma, Alibaba’s intelligent cockpit solution provider. Starting in 2026, the AI-enhanced IPA will debut in BMW Neue Klasse models produced in China.
BMW is building a new intelligent personal assistant with enhanced voice recognition and trip planning features, Bloomberg reports. The in-car AI agent can offer parking, nearby restaurant recommendations, and real-time traffic light information.
Alibaba told Bloomberg that the cars produced by Chinese automakers Xpeng Inc XPEV and Zeekr Intelligent Technology Holding ZK leveraged its Qwen model.
Over the next three years, Alibaba committed over 380 billion yuan ($52 billion) to AI infrastructure, such as data centers. It bagged a key deal to provide AI technology to Apple Inc’s AAPL iPhones in China.
China is a key market for BMW, which is led by electric vehicle makers like BYD Co BYDDY.
On Tuesday, BMW also launched its 360-degree full-chain AI strategy in China, focusing on digital production operations, comprehensive user experiences, and R&D innovation, YICAI reports.
Recently, Jim Cramer warned against potentially reducing U.S. computational capabilities for artificial intelligence in response to Alibaba Chair Joe Tsai’s comments about a potential data center bubble.
Price Action: BABA stock is up 0.20% at $133.01 premarket at last check Wednesday.
Also Read:
Photo by jackpress via Shutterstock
© 2025 Benzinga.com. Benzinga does not provide investment advice. All rights reserved.
Trade confidently with insights and alerts from analyst ratings, free reports and breaking news that affects the stocks you care about."
AAPL,Should SPDR Portfolio S&P 500 Value ETF  ( SPYV )  Be on Your Investing Radar?,20250326,Somewhat-bullish,0.258124,Style Box ETF report for ...,Zacks Commentary,www.zacks.com,https://www.zacks.com/stock/news/2435228/should-spdr-portfolio-sp-500-value-etf-spyv-be-on-your-investing-radar,
AAPL,Is Vident U.S. Equity Strategy ETF  ( VUSE )  a Strong ETF Right Now?,20250326,Somewhat-bullish,0.229911,Smart Beta ETF report for ...,Zacks Commentary,www.zacks.com,https://www.zacks.com/stock/news/2435231/is-vident-us-equity-strategy-etf-vuse-a-strong-etf-right-now,
AAPL,Should Goldman Sachs MarketBeta U.S. 1000 Equity ETF  ( GUSA )  Be on Your Investing Radar?,20250326,Somewhat-bullish,0.173142,Style Box ETF report for GUSA ...,Zacks Commentary,www.zacks.com,https://www.zacks.com/stock/news/2435232/should-goldman-sachs-marketbeta-us-1000-equity-etf-gusa-be-on-your-investing-radar,
AAPL,Is WisdomTree U.S. LargeCap ETF  ( EPS )  a Strong ETF Right Now?,20250326,Somewhat-bullish,0.222288,Smart Beta ETF report for ...,Zacks Commentary,www.zacks.com,https://www.zacks.com/stock/news/2435240/is-wisdomtree-us-largecap-etf-eps-a-strong-etf-right-now,
