Ticker,Title,Published,Sentiment,Sentiment Score,Summary,Source,Source_domain,URL,Full_Article
AAPL,Market Movers: Jerome Powell and Jensen Huang,20250325,Neutral,0.100336,"We also talk with Joe Cutillo, CEO of Sterling Infrastructure, about tariffs and other timely topics.",Motley Fool,www.fool.com,https://www.fool.com/investing/2025/03/25/market-movers-jerome-powell-and-jensen-huang/,"Founded in 1993, The Motley Fool is a financial services company dedicated to making the world smarter, happier, and richer. The Motley Fool reaches millions of people every month through our premium investing solutions, free guidance and market analysis on Fool.com, top-rated podcasts, and non-profit The Motley Fool Foundation.
Founded in 1993, The Motley Fool is a financial services company dedicated to making the world smarter, happier, and richer. The Motley Fool reaches millions of people every month through our premium investing solutions, free guidance and market analysis on Fool.com, personal finance education, top-rated podcasts, and non-profit The Motley Fool Foundation.
Founded in 1993, The Motley Fool is a financial services company dedicated to making the world smarter, happier, and richer. The Motley Fool reaches millions of people every month through our premium investing solutions, free guidance and market analysis on Fool.com, top-rated podcasts, and non-profit The Motley Fool Foundation.
Founded in 1993, The Motley Fool is a financial services company dedicated to making the world smarter, happier, and richer. The Motley Fool reaches millions of people every month through our premium investing solutions, free guidance and market analysis on Fool.com, personal finance education, top-rated podcasts, and non-profit The Motley Fool Foundation.

       You're reading a free article with opinions that may differ
       from The Motley Fool's Premium Investing Services. Become a Motley Fool member today to
       get instant access to our top analyst recommendations, in-depth research, investing resources,
       and more. Learn More

We also talk with Joe Cutillo, CEO of Sterling Infrastructure, about tariffs and other timely topics.
In this podcast, Motley Fool host Dylan Lewis and analysts Asit Sharma and Jason Moser discuss:
Joe Cutillo, CEO of Sterling Infrastructure, talks Motley Fool CEO Tom Gardner through his company's work on infrastructure projects, how the tariff picture figures into its outlook, and how to invest like a CEO.
To catch full episodes of all The Motley Fool's free podcasts, check out our podcast center. When you're ready to invest, check out this top 10 list of stocks to buy.
A full transcript is below.
This video was recorded on March 21, 2025
Dylan Lewis: We're parsing the words of Jerome Powell and Jensen Huang. This week's Motley Fool Money radio show starts now.
From Fool Global headquarters. This is Motley Fool Money.
It's the Motley Fool Money Radio Show. I'm Dylan Lewis. Joining me over the airwaves, Motley Fool senior analysts Jason Moser and Asit Sharma. Fools, wonderful to have you both here.
Jason Moser: Howdy.
Asit Sharma: Hey, Dylan.
Dylan Lewis: We've got the latest and greatest in AI from Nvidia, how a company focused on infrastructure projects is thinking about the tariff impact and, of course, the stocks on your radar this week. We're going to pick up Talking Fed, though. Jerome Powell and company got together to take a look at the economy that gave us thoughts on rates, economic outlook, inflation. Jason. Where were you paying attention?
Jason Moser: It's only March, but it sure feels like we've gotten a year's worth of volatility in the markets already. Certainly could be worse, S&P down around 3% so far this year, and that really is impressive. But you consider all of the magnificent seven stocks, save one are underperforming the market to date here. I just think that's an interesting perspective there on the markets, which leads us to then exactly how the fed is viewing things and they didn't exactly paint the rosiest picture. There are concerns of slowing growth and unemployment and stubborn prices, those concerns remain. Hear that the word stagflation being bandied about a little bit. But it is a very headline driven market.
Things are seemingly changing by the hour. I think it was noteworthy I saw an interview with the Chicago Federal Reserve President, Austan Goolsbee, who said that he still sees interest rate cuts coming, but there are rising risks to that. In the market right now, we've been hearing the Feds laying out this plan of two rate cuts this year. Now, there are other thoughts out there that we might see even more, three, perhaps. But generally speaking, the idea is that in the next 12-18 months, we should see rates coming down from where they are today. It just all depends on how all of this tariff stuff plays out ultimately and how things impact the economy. But there's no doubt there is a lot of uncertainty out there, a lot of trepidation. Businesses they're cutting back spending. They're holding off on big decisions, and that is having some ripple effects.
Dylan Lewis: It seems like there's a bit of wait and see all around. Consumers, businesses, the fed saying we are going to hold steady this round. We aren't going to make any changes. One thing that did jump out to me, Asit, I want to get your take on Jerome Powell saying, ""We do understand that sentiment has fallen off pretty sharply, but economic activity has not yet. The economy seems to be pretty healthy. What do you think of that?
Asit Sharma: I think it's a tough place for Jerome Powell and the Fed to be in because they still see an economy which is growing. They've clipped their internal estimates, I think, to around 1.7%. That's down from, if you heard two percentage points of growth or more. The economy is slowing. They see that, but it's not like it's coming to a standstill and this is where you get into a hard spot if you're making the decision because inflation is still persistent, so you have to be careful, which brings into question.
What Jason is pointing out here, if the fed is going to have three quarters of a percentage point of cuts this year, they better get busy. Because the fed likes to do quarter percentage increments, if they can. That means the next three quarters, they have to deliver what we might see as Jason was alluding to something in between where, maybe it's three quarters of a percentage point, or it's just half a percentage point because they're in this limbo. My bets are on the last two quarters of the year. We see a quarter percentage point cut each. But I'm glad that I have this day job and not Jerome Powell.
Dylan Lewis: I think we're all happy that we're doing what we're doing, and we're not sitting in that fed chair seat. Folks love to micro analyze the comments from Fed Chair Powell. Same goes for Nvidia CEO Jensen Huang. He is like the fed chair of AI, [LAUGHTER] if I may. He took the stage this week at Nvidia's GTC conference to talk about the company's chip offerings, what's coming up on their roadmap. Jason also gave a little bit of a Mea Culpa on some quantum computing comments that he made earlier this year.
Jason Moser: It seems like the Nvidia events are supplanting Apple. Now it's all about the Nvidia event and they used to do this once every two years. Now I think they're going to be going just on an annual cadence, which I think that makes a lot of sense. Nvidia is turning into this iPhone cycle, only a little bit more accelerated, isn't it? We're waiting each quarter and each year for them to reveal their next iteration in their GPUs and AI technology. This event really brought a lot to the table. Some was expected. I think there were some new things we learned, which was interesting. Robotics was a key theme of the event there. They had demonstrations and announcements related to their AI powered robotics platforms that ultimately is just working to bring AI, ultimately, into the physical world more. I thought really, we knew about Blackwell Ultra. That wasn't terribly new news.
But there was some interesting information they gave us on what's to be released here in the back half of 2026. It's the Vera Rubin system. This ultimately has two main components. It's a CPU called Vera, and then a new GPU design called Rubin. In fun fact here, it's named after American astronomer Vera Rubin. But this is Nvidia's first custom CPU design. It's based on a core design they've named Olympus. Ultimately, this is going to be something the Vera design is going to be twice as fast as the CPU that was used in last year's Blackwell chips. Like I said, they expect to start shipping these in the second half of 2026. It's going to be fun to continue following Nvidia because they do have to keep that hamster wheel of innovation going.
They always have to come out with something new, and that's impressive because it seems like they can do it. The risk is, with these types of companies, what happens if that innovation stalls or what happens when we hit peak AI, and we're getting the most value out of it, and we have to wait for the next revolution there. But for now, it sure seems like Nvidia is continuing to bring the goods.
Dylan Lewis: Asit, what caught your attention from the event?
Asit Sharma: I think this cadence that Jason mentioned was fun to look at. That is one thing everyone was expecting to see the next generations announced. I'll just point out in addition to what Jason said that Vera Rubin and its successor, the Vera and Rubin and Ultra, both are taking a step up in the type of complex memory that's used. They're going from what's called an HBM3 standard to an HBM4 standard. Which means that you can have much more computation on those chip GPU complexes. That was interesting. They talked about expanding the communication between GPUs. This is called NVLink scaling, how that is ramping up. It's going to double from the previous generation of Blackwell to this new Vera Rubin generation.
Getting us out of the technical details, though for a second, I think the quantum stuff was interesting, as you point out, Dylan you asked about, I am very interested in the quantum space. The Mea Culpa was nice to see because Jensen Huang's company in Nvidia stands to make money if they can marry up artificial intelligence compute with quantum. There's some problems in this whole quantum race that will probably be solved or better solved using AI. Of course, Nvidia wants to be there. Now he has to talk it up and pull the timescale back a bit from his previous comments that it would be 15-20 years away. We got to see a fun quantum day type symposium on Thursday. Looking forward to more quantum focused efforts from Nvidia in the future because they got to take that revenue when it's available.
Dylan Lewis: Another week, another Tesla headline. The Financial Times out with a piece this week detailing some accounting curiosities with Tesla's books noting that $1.4 billion seems to be missing. Asit, you are our resident CPA. Can you dust off your accounting books and wade through this one? There are no shortage of risks and maybe things weighing on Tesla's shareholders' minds. Where does this one rank for you?
Asit Sharma: I think for me, this is just one of different risk items that you want to look at if you're a Tesla shareholder. It's not necessarily a huge deal. I know it sounds salacious out there in the press, and I've had some fun as an armchair quarterback, trying to figure out what might be going on. The basic issue is that Tesla had some capital expenditures, but the corresponding amount isn't showing up as new fixed assets on its books. I've thought through some scenarios where look, this could be just a misclassification of how they're accounting for stuff can be fixed.
When you look at the big picture for Tesla, I think that's much more the concern here for most shareholders, which has to do with the resale value of Tesla's plummeting. We're hearing stories of panels falling off of cyber trucks. Of course, all the issues that are associated with Elon Musk's association with government policy, how that might be affecting the company and his statements. Now, I will say, look, the counter to that is last night, Elon had town hall with the troops and said, The future is still bright. From my perspective, we're going forward with the robotaxis with autonomous driving, so hang in there. If you're Tessa shareholder and you believe that long term thesis, that probably was reassuring to you.
Dylan Lewis: Coming up after the break, we've got fresh results from Nike, FedEx and Accenture. Stay right here. You're listening to Motley Fool Money.
Welcome back to Motley Fool Money I'm Dylan Lewis. Here on air with Asit Sharma and Jason Moser, and we're back on the earnings beat. Shares of FedEx down almost 10% following their earnings release this week. Asit feels like some of the tariff news swirling into a little bit of a rough outlook for this company.
Asit Sharma: I think that's exactly what it is, Dylan. FedEx reported earnings that were OK on the surface. Revenue was flattish at 22 billion. Operating income looked a lot like the previous year quarter at about $1.3 billion, and operating margin was a little bit lower by about a percentage point versus the prior year. Just looking at their headline numbers and their press release, nothing too much shifted there, but the outlook is uncertain, and it disappointed at Wall Street. Revenue is going to be flat to slightly down this year. Diluted earnings per share of around 15.15 or 15 bucks and 15 cents to a top of the range of close to 16 bucks. That was disappointing to Wall Street.
I think overarching this is just the fear that between tariffs, as you alluded to, which could really hurt FedEx, the potential that we could go into recession, which is never good for FedEx volumes and some uncertainty around this de minimis exemption, which could go away. I'm referring, of course, to the ability for shippers like Chan and Temu in China to export stuff to the US and not have to pay import duties if those shipments go directly to consumers and are under 800 bucks. Those small shipments, if those go away without the exemption, that could be a further hit on this business. I think FedEx is getting a trifecta of uncertainty from investors, and honestly, it probably deserves a little bit of multiple rerating. That is, maybe we pay a little bit less for future earnings because of all this uncertainty.
Dylan Lewis: In addition to the earnings release, there was also an analyst downgrade out this week. There was a note out from Loop Capital Analyst, Rick Patterson, and he summed all that up by saying,""It is a really bad recession stock."" Asit. lain and simple. When shipment volumes go down, when economic outlook and fewer packages are going out there, it is just going to bite FedEx. It's inevitable.
Asit Sharma: Let me put it this way. It's a really good recession stock if you don't own it. If you go into a recession, that might be the time to buy and hang on for a few years. He's not overly wrong there.
Dylan Lewis: Maybe a similar story with Nike. Shares also in the red this week down about 6% after the company reported another period of sales decline. We have been wondering, Jason, when is Nike going to turn it around? It seems like the answer is not quite yet.
Jason Moser: I was just going to say, let the turnaround begin, Dylan, that's what we're hoping for here. The numbers certainly were not impressive. I will say they are better than the leadership guided for a quarter ago. That's always nice to see. It makes you wonder if this isn't a leadership team that maybe kind of sandbags. I guess we'll have to wait and see. But revenue of $11.3 billion, it was down 9% from a year ago, earnings per share of 54 cents down from 77 cents from a year ago. Gross margin fell 330 basis points. That was within the range that leadership guided for 300-350 basis points there. Wholesale revenues a big point of friction for the company. Those were down 9%.
If you look at just the important segments, geographically speaking, North America was down 4%, China was down 15%. They did certainly talk to the concerns of tariffs and items goods that they have to import from places like Mexico and China. I think the market probably is a little bit more down on the guidance. They did guide for this Quarter 4 revenue to be down in the mid teens range. Again, we go back to maybe this is a sandbagging leadership. I don't know, but we will find out the next quarter when they announce, but I think that we will see margins continue to be challenged, 400-500 basis point dip they're talking about this coming quarter.
Again, the tariff concerns will continue. I think look, Elliott Hill, who is the new CEO here for this company, he has his work cut out for him and investors are going to need to give him some time to execute. I'm an IQ shareholder. I'm perfectly happy to give him the time to do that. Shares, still I feel like there's a pretty attractive valuation here for such a powerful global brand. Somewhere in that neighborhood of 20-21 times earnings right now for a company that has historically garnered a more premium multiple and you get a nice dividend to sit there and be patient, I don't have a problem with hanging in there and seeing how Elliott does.
Dylan Lewis: Management's playing an interesting expectations game here because for the results being what they were, they also sign posted for this upcoming quarter. Their fiscal fourth quarter, is going to reflect the largest impact from a lot of their actions. They are basically saying, there are going to be headwinds that are out of our control. There's a lot of stuff that we still need to do just to get ourselves right with inventory that's going to flow through and affect our business for a while. For people that are interested, Jason, is this one where maybe it makes sense to build out a position over time. There might be a little bit of pain ahead, but working into that position, dollar-cost averaging a bit.
Jason Moser: I think that's always a very reasonable way to look at it. I think with Nike, probably because it's such a big, large, established company and brand, you may not necessarily see these big moves one way or the other. Ultimately, the shares are down about 5% on this earnings report, which, again, wasn't that great. But building out a position in a company like this absolutely is a good way to go because you're. They've got boots on the ground, and they're working to re establish these wholesale relationships, but that's going to take some time, as well. We may see some more pain ahead. I think this next quarter is going to be very telling.
Dylan Lewis: I didn't intend for this earnings rundown to be all red, all downers, [LAUGHTER] but here we are wrapping us up Accenture joining Nike and FedEx down today. Company reported results, markets seem to zoom in on their government business. Asit, they're one of the first companies that we've been able to get a glimpse at the government efficiency efforts and how that might flow through to private companies.
Asit Sharma: This is the hold my beer for the other two earnings stories, Dylan, you think tariffs are bad? We have a company here which actually has such great depth in consulting. It is the world's largest consulting concern, and so surprising that for all the uncertainty we've heard about, the effects not being quantifiable yet for tariffs, on the other side, this government cost cutting initiative, it's quick and it's quantifiable for Accenture. They had a very decent quarter net bookings. That's a decrease in US dollar terms, but flattish, if you take out currency fluctuations. Their generative AI business. They had new bookings of 1.4 billion. That's small in comparison to revenues, which were almost 17 billion this quarter, but it shows the growth of that business.
On the other side, CEO Julie Sweet used the word government like eight times in the transcript, which is not typical and said they said, Look, about 8% of our global revenue and 16% of our America's revenue, in this fiscal year is represented by Accenture Federal Services. When you think about numbers that hit that level of between high single digits and teens, that can be consequential to trim your growth on the margins and that's what we're seeing with this outlook from Accenture. Which is despite the positive parts of their business, if they start getting crimped on what's a very stable and core part of the business, that flattish outlook then starts to look like it could be in jeopardy, and maybe we're faced with a company that for the next several quarters, could be looking at slight declines in revenue and bookings.
Dylan Lewis: I have to imagine we'll see echoes of this when we see reports from some of the other consulting businesses that have government contracts. Anywhere else with that government story that you're paying attention to? Any other industries?
Asit Sharma: It's funny because if you look at where a lot of the opportunity for cybersecurity companies, the best of the breed lies, it's with something called FedRAMP, which is getting your authorizations to do a lot of business with the federal government because your stuff is so secure. I think we might see some headwinds there.
Dylan Lewis: Asit, Jason, fellas, we're going to see you guys a little bit later in the show. Up next, our investing team talks tariff impacts with a company that specializes in the prep and buildout for major infrastructure projects. Stay right here. You're listening to Motley Fool Money.
Welcome back to Motley Fool Money. I'm Dylan Lewis. We like to dig into the weeds here at TMF. Getting into the details and the major themes affecting the companies that we follow. Last week, Motley Fool CEO Tom Gardner and CIO Andy Cross chatted with Joe Cutillo. He's the CEO of Sterling Infrastructure, and they're a firm focused on the preparation for major infrastructure projects. Together, they talk through the business, how the macro picture factors into the company's outlook and the idea of investing like the CEO of a company.
Andy Cross:
Tom Gardner: The opening question is, how would you describe the business to a newcomer, somebody who's never heard of Sterling Infrastructure before. Obviously, a lot of our viewers today are shareholders, but there are certainly some people in the audience that have never heard of the company before, and now they get an opportunity to hear it from you.
Joe Cutillo: We're an infrastructure service provider that focuses in three different segments. Our Eva structure segment is our largest. In that segment, what we do is site selection, site development for mission critical type applications, predominantly, which could be data centers, onshoring and manufacturing. We've done a lot of battery plants, solar plants. You name it if it's big and needs a lot of dirt moved and infrastructure put in. We do that particular type of project. That market is growing tremendously for us. We see a very strong multi year trend ahead of us, not only with the backlog that we have in place, but the projects we see on the drawing boards and what our customers are telling us. The second segment that we have is around transportation solutions.
This is where the company started back when I joined in 2015. About 95% of our business was in low bid, heavy highway work. That's a very difficult business, very high risk, very low reward. But as you talk about the transformation, today, less than 10% of our business is in low bid heavy highway work. That's why you've seen the margin migration up significantly over the history of that time. We focus set business more on value added type projects in the transportation space, whether that's design build or alternative delivery projects, where instead of just being low cost, we have a value proposition to the end customer at the end of the day that we can design and build the project better and faster in a lot of cases, not necessarily cheaper for the end customer. Also, we've migrated toward aviation and rail. We'll do runways, taxiways, those activities.
Then on the rail side, we have what we call a rapid bridge replacement and some technologies and uses that we can pre-build products, and instead of taking months to replace a damaged bridge or a defunct bridge, we can do that in weeks. As you can imagine, if you're a railroad, they know exactly what an hour of downtime is or a day of downtime that has a high-value proposition for them. Our last segment is in building solutions, and we're in the three fastest-growing, largest markets in the US, which is Dallas, Fort Worth, Houston, and Phoenix. There it's a little different business from the rest in that we do concrete slabs and plumbing for the major builders.
Pulte, Lennar, Horton, are three of our largest customers. We've seen very nice growth in that market over time. If you put that all together, we've built a portfolio of these three segments over the last six or seven years. That's really the beginning point of where we're going in the future. Everybody asks us, you've done such a great job of transforming the business and going from low single digit margins to we have the best margins, the best cash flow, the best returns of anybody in the specialty infrastructure space to where do you go now? This is just the beginning, and that's what's really exciting, what we cannot only add to the three segments that we have today, but we're looking for that fourth leg of the school that has 10-20 years of growth attached to it, as well.
Tom Gardner: One of the pieces of guidance I give to our members in investing is try to align your time arises as investor with the time rise and to the CEO of that company. There are a lot of rapid turnover companies. There are low quality companies everywhere. There are promotional things, and people take companies public after 18 months, just taking advantage of and getting pushed into public markets by VC or private equity. There are a lot of bad and mediocre scenarios.
But if you find a great company, and you should attach your time horizon to the time horizon to that CEO. If you're going to find a great company, that CEO is going to have been at Sterling Infrastructure since 2015, and is going to be talking about, what are the next 10 or 20 years for and thinking about the company in that way, the similar things you'd hear from Jim Sinegal at Costco. Jeff Bezos basically planning 10 years forward at Amazon to the point where they felt that they knew what the earnings report was going to be three years in advance of it at Amazon. I'd love it if you'd speak to our members about going through a period here, short term, where the stock goes 200-120. What you think about, like, obviously, one point on the continuum is, I don't even pay attention. Another is, no, I pay attention, this and that, I get these signals. I'm learning it. But it certainly isn't for a long term CEO a tough moment as to whether or not to stay employed at the business or to continue to stock that you have.
Joe Cutillo: Yeah, it's funny. When we took the big dip, I'll tell you, a lot of friends call and say, Are you, going to jump off a bridge or what's going on, man? Like, for the first couple days, I didn't even watch it. My answer to people is this, I'm not looking at $200 a share. My expectations are much higher than $200 a share. When people ask, Are you worried about getting back to two, I say, No, I'm not worried about getting back to two. I'm worried about getting back to where I want to be or getting to where I want to be. Two isn't in my sights. We'll get there. The market will correct. People will realize we continue to deliver the results. I feel we're going to deliver and the markets are going to do what I believe they're going to do based on what we've seen. We'll get back through that. This is a temporary setback.
I bought it's public knowledge. I bought $1 million of stock last week, I think it was. If it stays down, I'll probably buy some more at some point in time. We're confident in what we know where the company's going, what the markets are giving us right now. I can just tell you, my sites are much higher than $200 a share.
Tom Gardner: What are the impacts now of changing dynamics and regulation, new administration? What are any pluses or minuses for Sterling infrastructure in what seems like a pretty dramatic shift, and, obviously, the tariffs and negotiation and a lot of uncertainty around it. What's the impact on you at least an intermediate-term basis?
Joe Cutillo: Well, I think the perception is there's going to be a lot of impacts. The reality is, and I just talked to some of my friends that are CEOs and similar businesses and other spaces. We've also said the same thing. We just went through COVID, where we were seeing 30% increases in inflation on a monthly, quarterly basis something we have never seen before. If you look at the prices that we were paying for materials and COVID and you look at them now today, if the prices went up 10, 15, 20% because of tariffs, we're still nowhere near what we were fighting from the peak of these material costs. This is like kindergarten compared to what we went through. It's not to say we won't see it. It's not to say you can't see a couple months of pain as you get your contracts updated or you get to the new projects.
But we managed our way through that pretty well. As a matter of fact, much better than I would have thought the world would have managed through it. The reality is, if our material costs go up, we're going to pass it on in pricing. You have that interim of time in some of these contracts before the next phase starts or the next Peace starts, so you might get caught in it. But a lot of our materials first in our transportation, our steel has to be made in America anyways. It's been made in America has to be made in America, all that stuff. People talk about rebar. Well, we do get it from China, but we can get it from Turkey. There's other places we can get it from. It may not go up 25%. It may go up 3% or 4%. What I always worry more about is availability. We can manage inflation and prices. If you don't have products, that becomes very challenging to get stuff built.
We'll get through that. We're all caught a little bit in the tailspin of there's so many things going on, whether it's tariffs or everything else. The market doesn't like uncertainty, and they're trying to figure it out, and sometimes they overthink it, sometimes they underthink it. I just think there's a lot of balls up in the air. We've spent very little time internally worrying about or having to even come up with any planning around the tariff impact on us.
Tom Gardner: It's really interesting thinking this in the context of the concept I really love from the writer Nassim Taleb who wrote a book entitled Antifragile. Essentially the concept of Antifragile not to spoil the whole book. It's a wonderful book is at one end of the continuum, you're fragile. You're a vase that holds flowers. If you're dropped on the ground, you break. You have really only one use. It's a limited function, and it's a fragile. It's risky in its environment. You think the opposite of that is resilient, but resilient isn't the opposite of fragile. Resilient would mean you drop it, and it's fine. It bounces back. It's fine. Antifragile is you thrive on volatility.
Each time a business goes through the complexity of the pandemic, I also think of the writer Peter Drucker, who said, I basically love to find companies that have gone through some hell because they know once that scare me got born into a beautiful environment, everything was rosy for them, flourishing, and then they get hit for the first time. It's quite interesting to hear your context on this because it's obvious hearing you express it, it's obvious that the pandemic was a much greater challenge than the levels of uncertainty right now.
Joe Cutillo: That's what we believe. We actually believe that that if this continues we think there's huge upside for us. All of the whether it's a car manufacturers or pharmaceutical, everything's that's all work for us. We don't care if we're paying $2 a gallon for diesel or $10. The work's still going to get done. Unfortunately, the cost of that project may go up 10%. But we're more worried about that work coming. That's good for us. We're less concerned about the cost of that particular material.
Dylan Lewis: Listeners, this interview came from our Daily Fool 24 Livestream. Motley Fool members can access it by going to fool.com/24, and you can access it for free daily on YouTube.
We'll drop a link down in the show notes for everyone listening to this week's radio show in podcast Feeds. Up next, Jason Moser and Asit Sharma are back with me to talk about the stocks on their radar this week. Stay right here. You're listening to Motley Fool Money.
As always, people in the program may have interest in the stocks they talk about and the Motley Fool may have formal recommendations for or against, so don't buy or sell anything based solely on what you hear. All personal finance content follows Motley Fool editorial standards. It's not approved by advertisers. Motley Fool only picks products. It'd personally recommend friends like you.
I'm Dylan Lewis, joined again by Asit Sharma and Jason Moser. Jason as we tape, the first round of March Madness is underway. Jason, unfortunately, your beloved Wofford Terriers were in the dance, got bounced by Tennessee in the first round. Did that bust your bracket?
Jason Moser: No, it didn't. Listen, it was a 15 versus a two seed. The odds are telling you something there. Look, Wofford 1,800 plus students. It's a tiny little school. Even when I went there in 95, graduated in 95, it's always been basically that size. Going up against Tennessee is like 40,000 students there. It is a really difficult monumental task to be able to pull that one off. But I tell you, I was really proud watching that game, watching the fight in those guys. They had a difficult year with some injuries and some folks that left. They were able to get it to the Southern Conference Tournament, and then they just got on a heater. The best part about this still little secret here. My wife went to Furman.
You can imagine the back and forth in this household after that game. We always have fun ribbing each other because Furman is a very good team as well. But I was very proud to see that. Just getting to the tournament was a real success, and it reminded me of how grateful I was to be able to watch them beat Seton Hall in the first round. I think it was six years ago. These are just occasions that don't come around all that often. You got to relish them when you get them. Only one team gets to win their last game of the season. That's exactly right. Just being there's fun.
Dylan Lewis: Opposite UNC is up later this afternoon after we tape today. How are you feeling about your tar heels?
Asit Sharma: I'm feeling great win or lose. I really like the way this team has come together with a lineup tweak over the last 10 or 11 games. It's a different team on the ground. I love what happened this past week, Dylan. For those of you who don't know, UNC had a very poor record against so called quad 1 teams, which is one of the criteria that feeds up into the selection committees doling out of bids, and we were the last team into the tournament. It was fun to go from a team which, of course, among Blue Bloods, has its detractors, but to go from that, which is generally beloved team on the college landscape to a revival team, the most revival team in the nation. Was refreshing to pick. It sharpened my tribal instincts. I'm like, these are my people. Blame the committee. Don't blame us.
Jason Moser: The Gaelic really justified that pick, though, as it. They justified that pick with that playing game.
Asit Sharma: Totally, they played a really great play in game. I think Old Miss is a very formidable team, and we have our work cut out for us. I think we're going to squeak by, but I'm happy with whatever happens. You got to finish strong in life.
Dylan Lewis: It sounds, Asit like you and UNC both have a little bit of a chip on your shoulder heading into this tournament.
Asit Sharma: A man. I wake up in the morning I need a reason to compete. I look at my slacks and I see Jamoi has turned out some great research, and I'm like, I'm on it. I'm on my game this morning.
Dylan Lewis: Yeah, competitiveness. It's a core value. Here the Motley Fool. Before we get over to Radar 6, Jason, any investing lessons for people as they're watching the games this weekend?
Jason Moser: Well, I referred back to the size of these two schools, 1,800 versus like 40,000, and it just always takes me back to small caps. Small Caps can be really powerful. You just got to be patient with them. Every once in a while, they'll show up for you and they'll really the world on fire. That's what I associate with this one. Wofford small, but, man, they've got a lot of fight, a lot of strength in them, and I see a lot of growth in their future.
Dylan Lewis: I can hear one shining moment, just playing in the background there. Asit, what about you?
Asit Sharma: Hubert Davis, the coach of UNC, has a great metaphor he uses with his players, which is the blinders that you put on a horse when you're leading it to the race. You take the blinders off. Before the race, right before the race so the horse can just be focused and not be distracted by the outside environment. Sometimes in investing, it really feels like the distractions loom large. The market is down. People are talking down your favorite businesses, and you want to just give up. But those are the great times to just keep the blinders on. What I mean by that is focus on the businesses, not all the noise of the market and share price today. Stay focused on what got you into those businesses in the first place. Their fundamentals and play the game and just be in it for the long term as great teams are. Wofford is a formidable team every year. They have a long term focus, and so does UNC.
Dylan Lewis: Very on theme for Asit to say, Ignore the haters. Do what you got to do. [LAUGHTER] Let's get over to stocks on our Radar. Our man behind the glass, Dan Boyd is going to hit you with a question. Asit, you're up first. What are you looking at this week?
Asit Sharma: I have BYD and this is an electrical vehicle company started in China. My and Jason's great colleague, Emily Flippen had put this in front of my notice. BYD as many people know as a competitor to Tesla and lots of other great EV companies, they are ingenious in their engineering, and they've learned to build a scale up very cheap car. We don't see it here in the US because of import restrictions. But the company's doing really well financially, and it just came out with the announcement that it can charge an electrical vehicle in five minutes, which could be a possible game changer. I'm looking to learn more about this company, and I think anyone who's interested in the EV landscape, this deserves your attention. Take a look.
Dylan Lewis: Dan, a question about BYD, which trades over the counter as BY DDY.
Dan Boyd: We talked about how competitiveness is a core value here at The Motley Fool, and is the competitive atmosphere brought to the table by BYD going to sharpen Tesla, or are they just going to continue to eat Tesla's lunch?
Asit Sharma: I think it's going to sharpen Tesla's focus, and I think sometimes you need a competitor to pull management back into what they set out to do. If you are a shareholder in Tesla and see Elon must be distracted by other things. This is the recipe for your shares to gain to bring him back into sharp focus on his business as BYD continues to succeed.
Dylan Lewis: Jason, what's on your Radar this week?
Jason Moser: There pots and pans every night, Dylan on Williams Sonoma, Ticker WSM remember, this is a retailer with a number of popular brands under its umbrella. It's namesake as well with Pottery Barn, West Elm, and others. A longtime Stock Advisor recommendation has done very well for members. If you look at the five year chart on this thing. It's crazy. Total return almost 900%. Just reported a relatively decent quarter. Comps are up 3.1% gross margin of 130 basis points, operating margin expansion as well. Boosted the quarterly dividend 16% to $0.66 per share. The stock sold off on the report, I think, mostly related to guidance. They just see flat sales and again, some tariff concerns potentially hitting margins here in the coming year.
Dylan Lewis: Dan, a question about William Sonoma. Ticker, WSM.
Dan Boyd: Do you ever buy any of their snacks or candies or anything, Jason, or are you just a pots and pans guy?
Jason Moser: Just a pots and pans guy, Dan, pots and pans.
Dylan Lewis: Dan, pots and pans or EVs? Which way you going this week?
Dan Boyd: I like BYD, but I don't know how to buy them, so I guess by default, it's going to be Williams Sonoma.
Jason Moser: I'll take what I can get.
Dylan Lewis: That feels like a shallow victory. I don't know about that one. Dan, appreciate you weighing in on the Radar 6 this week. Asit, Jason, appreciate you bringing them to us. That's going to do it for this week's Motley Fool Money Radio show. Shows mixed by Dan Boyd. I'm Dylan Lewis. Thanks for listening. We'll see you next time.
John Mackey, former CEO of Whole Foods Market, an Amazon subsidiary, is a member of The Motley Fool's board of directors. Asit Sharma has positions in Amazon, Nvidia, and Williams-Sonoma. Dan Boyd has positions in Amazon. Dylan Lewis has no position in any of the stocks mentioned. Jason Moser has positions in Amazon, Apple, and Nike. Tom Gardner has positions in Tesla. The Motley Fool has positions in and recommends Accenture Plc, Amazon, Apple, D.R. Horton, FedEx, Lennar, Nike, Nvidia, Sterling Infrastructure, Tesla, and Williams-Sonoma. The Motley Fool recommends BYD Company. The Motley Fool has a disclosure policy.
Stocks Mentioned
*Average returns of all recommendations since inception. Cost basis and return based on previous market day close.
Related Articles

        Invest better with The Motley Fool. Get stock recommendations, portfolio guidance, and more from The Motley Fool's premium services.
      
Making the world smarter, happier, and richer.
© 1995 - 2025 The Motley Fool. All rights reserved.
Market data powered by Xignite and Polygon.io.
About The Motley Fool
Our Services
Around the Globe
Free Tools
Affiliates & Friends"
