Ticker,Title,Published,Sentiment,Sentiment Score,Summary,Source,Source_domain,URL,Full_Article
AAPL,"The ""Magnificent Seven"" Stocks Are Selling Off. Here Are My Top 5 to Buy Now.",20250326,Somewhat-bullish,0.226443,"The ""Magnificent Seven"" stocks have been incredibly successful stock picks, but most have sold off so far in 2025, some heavily. Their lower prices are intriguing, but I don't think all of them make great buys right now. While five look great, I'm avoiding two. GOOGL data by YChartsContinue ...",Motley Fool,www.fool.com,https://www.fool.com/investing/2025/03/25/the-magnificent-seven-stocks-are-selling-off-here/,"Founded in 1993, The Motley Fool is a financial services company dedicated to making the world smarter, happier, and richer. The Motley Fool reaches millions of people every month through our premium investing solutions, free guidance and market analysis on Fool.com, top-rated podcasts, and non-profit The Motley Fool Foundation.
Founded in 1993, The Motley Fool is a financial services company dedicated to making the world smarter, happier, and richer. The Motley Fool reaches millions of people every month through our premium investing solutions, free guidance and market analysis on Fool.com, personal finance education, top-rated podcasts, and non-profit The Motley Fool Foundation.
Founded in 1993, The Motley Fool is a financial services company dedicated to making the world smarter, happier, and richer. The Motley Fool reaches millions of people every month through our premium investing solutions, free guidance and market analysis on Fool.com, top-rated podcasts, and non-profit The Motley Fool Foundation.
Founded in 1993, The Motley Fool is a financial services company dedicated to making the world smarter, happier, and richer. The Motley Fool reaches millions of people every month through our premium investing solutions, free guidance and market analysis on Fool.com, personal finance education, top-rated podcasts, and non-profit The Motley Fool Foundation.

       You're reading a free article with opinions that may differ
       from The Motley Fool's Premium Investing Services. Become a Motley Fool member today to
       get instant access to our top analyst recommendations, in-depth research, investing resources,
       and more. Learn More

Key Points
The ""Magnificent Seven"" stocks have been incredibly successful stock picks, but most have sold off so far in 2025, some heavily. Their lower prices are intriguing, but I don't think all of them make great buys right now. While five look great, I'm avoiding two. 

GOOGL data by YCharts
I wouldn't buy any Apple (NASDAQ: AAPL) or Tesla (NASDAQ: TSLA) stock right now. These two companies have problems.
Apple hasn't realized a game-changing or innovative product in some time, and has failed to grow its revenue meaningfully over the past three years. It finally surpassed the trailing-12-month total set in the fall of 2022 this past quarter, and Wall Street analysts project only 4.6% and 8% growth in FY 2025 and FY 2026, respectively. On top of that, Apple has a premium valuation compared to the other stocks (only Amazon and Tesla trade at a higher forward price-to-earnings ratio, and Microsoft's is equal). As a result, I want to avoid Apple.
Tesla is having some brand issues, which can be directly tied to CEO Elon Musk's involvement in President Donald Trump's administration. Whether you agree with his actions or not, it's indisputable that some Tesla owners and potential buyers are angry. Until Tesla gets its brand image straightened out, I'll probably avoid the stock.
The remaining five stocks on this list are Nvidia (NVDA -1.42%), Microsoft (MSFT -0.04%), Alphabet (GOOG -1.38%) (GOOGL -1.41%), Meta Platforms (META -0.92%), and Amazon (AMZN 0.41%), and each looks intriguing at its current price tag.
Following the recent sell-off, these five stocks are down 15%-20% from their highs. Alongside that, each is trading near relative valuation lows from the past three years.

GOOGL data by YCharts

GOOGL PE Ratio (Forward) data by YCharts
Alphabet is by far the cheapest at 19 times forward earnings -- a metric that uses analyst estimates -- which prices it well below the S&P 500's (SNPINDEX: ^GSPC) 20.5 forward P/E. I believe growth rates that are projected to be above market pace for the next few years make Alphabet a no-brainer buy. 
The other four stocks trade at a premium to the S&P 500, so they need convincing growth estimates to justify that premium to me.
While Nvidia is one of the more expensive stocks of the five, it's also projected to grow the fastest. Wall Street analysts project that Nvidia will grow its revenue by 57% in FY 2026 (the current year) and 23% in the next fiscal year, far outpacing the 10% the S&P 500 averages.
On top of that, Nvidia CEO Jensen Huang sees a path to $1 trillion in data center revenue by 2028, a potentially magnificent boon for his company, making today's stock price look like an absolute steal. 
Microsoft and Amazon also make for great buys (and Alphabet as well) because of their exposure to cloud computing. Cloud computing is a key beneficiary of the AI arms race, as many companies don't have the computing power necessary to run AI models, so they rent that power from a cloud computing provider.
Amazon Web Services (AWS), Azure (Microsoft's platform), and Google Cloud (Alphabet's platform) are the largest cloud computing providers by market share and will benefit from a huge spending wave that's expected to expand the cloud computing market opportunity from $752 billion in 2024 to $2.4 trillion in 2030. This is monstrous growth and could easily propel these stocks into market-beating territory.
Last on this list is Meta, which has been a huge spender in the AI arms race. Meta uses AI to maintain its dominance in the social media space, where it generates nearly all of its revenue from ads on those platforms. Meta also has several exciting projects that it's working on in its Reality Labs division. Meta's revenue could take off if a new sales stream emerges should any of these become a hit product. Even without that, its revenue is expected to increase by 15% in 2025 and 14% in 2026, which makes it a great stock to own if you're trying to beat the market. 
The ""Magnificent Seven"" stocks are still relevant in today's market, but you need to be selective about which ones you buy. The latest market sell-off is a great chance to scoop up some of them on sale, and I'm willing to bet that at least some them will beat the market over the next three to five years.
John Mackey, former CEO of Whole Foods Market, an Amazon subsidiary, is a member of The Motley Fool's board of directors. Suzanne Frey, an executive at Alphabet, is a member of The Motley Fool's board of directors. Randi Zuckerberg, a former director of market development and spokeswoman for Facebook and sister to Meta Platforms CEO Mark Zuckerberg, is a member of The Motley Fool's board of directors. Keithen Drury has positions in Alphabet, Amazon, Nvidia, and Tesla. The Motley Fool has positions in and recommends Alphabet, Amazon, Apple, Meta Platforms, Microsoft, Nvidia, and Tesla. The Motley Fool recommends the following options: long January 2026 $395 calls on Microsoft and short January 2026 $405 calls on Microsoft. The Motley Fool has a disclosure policy.
Stocks Mentioned
*Average returns of all recommendations since inception. Cost basis and return based on previous market day close.
Related Articles

        Invest better with The Motley Fool. Get stock recommendations, portfolio guidance, and more from The Motley Fool's premium services.
      
Making the world smarter, happier, and richer.
© 1995 - 2025 The Motley Fool. All rights reserved.
Market data powered by Xignite and Polygon.io.
About The Motley Fool
Our Services
Around the Globe
Free Tools
Affiliates & Friends"
AAPL,"Big Tech Companies Employ Majority Of H-1B Visa Workers: Where Do Amazon, Google, Meta Rank? - Amazon.com  ( NASDAQ:AMZN ) ",20250325,Neutral,0.14592,"Amazon tops the list with 11,000 H-1B visa approvals in 2023. Google comes in fifth place and employed almost 5,550 H-1B workers in 2023, less than half compared to Amazon.",Benzinga,www.benzinga.com,https://www.benzinga.com/government/regulations/25/03/44485001/big-tech-companies-employ-majority-of-h-1b-visa-workers-where-do-amazon-google-meta-rank,"Benzinga Rankings give you vital metrics on any stock – anytime.
Big tech companies are employing the majority of approved H-1B visa workers in the U.S., according to research from the Pew Research Center.  Here's a look at which companies top the list.
Amazon.com, Inc. AMZN came in first with 11,000 H-1B visa approvals in 2023, marking the third consecutive year the e-commerce giant topped the list. Cognizant Technology Solutions Corp. CTSH, Infosys Ltd. INFY and Tata Consultancy Services, Inc. round out the top four. 
Read Next: Homebuilders KB Home, Lennar Cut Prices As Buyer Demand Has ‘Slowed Materially’
Alphabet, Inc.'s GOOG GOOGL Google came in fifth place and employed almost 5,550 H-1B workers in 2023, less than half compared to Amazon.
Microsoft Corp. MSFT followed in sixth with nearly 4,800 workers and Apple Inc. AAPL came in right behind at 3,800.
Meta Platforms, Inc. META came in eighth place with 3,371 H-1B workers and currently faces a lawsuit claiming the company systematically favors foreign workers. 
Plaintiffs in the case argue that Meta has a pattern of prioritizing visa holders for employment, a claim supported by court-cited statistics: 15% of Meta’s U.S. workforce holds H-1B visas, compared to 0.5% across all industries.
Meta has denied the allegations and called the discrimination claims “baseless.”
Tesla, Inc. TSLA ranked near the bottom of the 30 companies on Pew Research's list with less than 1,100 H-1B visas, accounting for 0.3% of total H-1B approvals. Tesla CEO Elon Musk has been an outspoken proponent of the visa program, likening it to drafting talented foreign players to bolster an NBA team. 
The H-1B program, established in 1990, enables U.S. employers to recruit skilled foreign professionals with bachelor's degrees or equivalent qualifications for specialized roles. 
H1-B visas are initially valid for three years, renewable up to six years, with potential extensions for those pursuing permanent residency. In 2023, 400,000 H-1B applications were approved with 65% of approvals being renewals.
Read More: 
Photo: Cristian Storto via Shutterstock
Benzinga Rankings give you vital metrics on any stock – anytime.
© 2025 Benzinga.com. Benzinga does not provide investment advice. All rights reserved.
Trade confidently with insights and alerts from analyst ratings, free reports and breaking news that affects the stocks you care about."
AAPL,ARM Stock Declines 10% in a Month: Buy or Wait for Further Fall?,20250325,Bullish,0.369049,"Given the recent fall in Arm Holdings shares, we evaluate the stock's current position to determine whether it presents a good investment opportunity.",Zacks Commentary,www.zacks.com,https://www.zacks.com/stock/news/2435040/arm-stock-declines-10-in-a-month-buy-or-wait-for-further-fall,
AAPL,Spotify Stock Soars 130% in a Year: Is it Still a Buy Now?,20250325,Bullish,0.537158,"Given SPOT's price rise, we analyze its current position to find out whether investors should buy it, hold it, or book profits.",Zacks Commentary,www.zacks.com,https://www.zacks.com/stock/news/2435030/spotify-stock-soars-130-in-a-year-is-it-still-a-buy-now,
AAPL,"Market Mechanics Driving Stocks, Tariffs Whipsaw, AI Data Center Bubble Warning",20250325,Somewhat-bullish,0.202329,"To gain an edge, this is what you need to know today. Please click here for an enlarged chart of SPDR S&P 500 ETF Trust ( SPY ) which represents the benchmark stock market index S&P 500 ( SPX ) .",Benzinga,www.benzinga.com,https://www.benzinga.com/markets/equities/25/03/44476483/market-mechanics-driving-stocks-tariffs-whipsaw-ai-data-center-bubble-warning,"To gain an edge, this is what you need to know today.
Market Mechanics Driving Stocks
Please click here for an enlarged chart of SPDR S&P 500 ETF Trust (SPY) which represents the benchmark stock market index S&P 500 (SPX).
Note the following:
After a rip-roaring rally, Chinese stocks, notably AI stocks, are beginning to see money outflows.
In the early trade, money flows are positive in Apple Inc (AAPL), Amazon.com, Inc. (AMZN), Alphabet Inc Class C (GOOG), Meta Platforms Inc (META), Microsoft Corp (MSFT), and Tesla Inc (TSLA).
In the early trade, money flows are negative in NVIDIA Corp (NVDA) on the warning from Joe Tsai.
In the early trade, money flows are positive in (SPY) and Invesco QQQ Trust Series 1 (QQQ).
Investors can gain an edge by knowing money flows in SPY and QQQ.  Investors can get a bigger edge by knowing when smart money is buying stocks, gold, and oil.  The most popular ETF for gold is SPDR Gold Trust (GLD).  The most popular ETF for silver is iShares Silver Trust (SLV).  The most popular ETF for oil is United States Oil ETF (USO).
Bitcoin is seeing buying.
It is important for investors to look ahead and not in the rearview mirror.  The proprietary protection band from The Arora Report puts all of the data, all of the indicators, all of the news, all of the crosscurrents, all of the models, and all of the analysis in an analytical framework that is easily actionable by investors. 
Consider continuing to hold good, very long term, existing positions. Based on individual risk preference, consider a protection band consisting of cash or Treasury bills or short-term tactical trades as well as short to medium term hedges and short term hedges. This is a good way to protect yourself and participate in the upside at the same time.
You can determine your protection bands by adding cash to hedges.  The high band of the protection is appropriate for those who are older or conservative. The low band of the protection is appropriate for those who are younger or aggressive.  If you do not hedge, the total cash level should be more than stated above but significantly less than cash plus hedges.
A protection band of 0% would be very bullish and would indicate full investment with 0% in cash.  A protection band of 100% would be very bearish and would indicate a need for aggressive protection with cash and hedges or aggressive short selling.
It is worth reminding that you cannot take advantage of new upcoming opportunities if you are not holding enough cash.  When adjusting hedge levels, consider adjusting partial stop quantities for stock positions (non ETF); consider using wider stops on remaining quantities and also allowing more room for high beta stocks.  High beta stocks are the ones that move more than the market.
Probability based risk reward adjusted for inflation does not favor long duration strategic bond allocation at this time.
Those who want to stick to traditional 60% allocation to stocks and 40% to bonds may consider focusing on only high quality bonds and bonds of five year duration or less.  Those willing to bring sophistication to their investing may consider using bond ETFs as tactical positions and not strategic positions at this time.
The Arora Report is known for its accurate calls. The Arora Report correctly called the big artificial intelligence rally before anyone else, the new bull market of 2023, the bear market of 2022, new stock market highs right after the virus low in 2020, the virus drop in 2020, the DJIA rally to 30,000 when it was trading at 16,000, the start of a mega bull market in 2009, and the financial crash of 2008. Please click here to sign up for a free forever Generate Wealth Newsletter.
© 2025 Benzinga.com. Benzinga does not provide investment advice. All rights reserved.
Trade confidently with insights and alerts from analyst ratings, free reports and breaking news that affects the stocks you care about."
AAPL,Live Nation Entertainment Rises 22% in a Year: Time to Buy the Stock?,20250325,Bullish,0.392535,"LYV is well-positioned for growth in 2025 with high ticket volume and expansion of new venues, which investors can see as a compelling entry point in the year.",Zacks Commentary,www.zacks.com,https://www.zacks.com/stock/news/2434927/live-nation-entertainment-rises-22-in-a-year-time-to-buy-the-stock,
AAPL,4 Tech Stocks Penetrating the Health and Fitness Wearables Market,20250325,Somewhat-bullish,0.285962,"Let's take a look at four tech stocks, AAPL, GOOGL, GRMN and META, which are penetrating the Health and Fitness Wearables Market.",Zacks Commentary,www.zacks.com,https://www.zacks.com/stock/news/2434924/4-tech-stocks-penetrating-the-health-and-fitness-wearables-market,
AAPL,"Inquiry Into Apple's Competitor Dynamics In Technology Hardware, Storage & Peripherals Industry - Apple  ( NASDAQ:AAPL ) ",20250325,Somewhat-bullish,0.282258,"In today's rapidly changing and fiercely competitive business landscape, it is essential for investors and industry enthusiasts to thoroughly analyze companies. In this article, we will conduct a comprehensive industry comparison, evaluating Apple AAPL against its key competitors in the ...",Benzinga,www.benzinga.com,https://www.benzinga.com/insights/news/25/03/44475380/inquiry-into-apples-competitor-dynamics-in-technology-hardware-storage-amp-peripherals-industry,"Benzinga Rankings give you vital metrics on any stock – anytime.
In today's rapidly changing and fiercely competitive business landscape, it is essential for investors and industry enthusiasts to thoroughly analyze companies. In this article, we will conduct a comprehensive industry comparison, evaluating Apple AAPL against its key competitors in the Technology Hardware, Storage & Peripherals industry. By examining key financial metrics, market position, and growth prospects, we aim to provide valuable insights for investors and shed light on company's performance within the industry.
Apple is among the largest companies in the world, with a broad portfolio of hardware and software products targeted at consumers and businesses. Apple's iPhone makes up a majority of the firm sales, and Apple's other products like Mac, iPad, and Watch are designed around the iPhone as the focal point of an expansive software ecosystem. Apple has progressively worked to add new applications, like streaming video, subscription bundles, and augmented reality. The firm designs its own software and semiconductors while working with subcontractors like Foxconn and TSMC to build its products and chips. Slightly less than half of Apple's sales come directly through its flagship stores, with a majority of sales coming indirectly through partnerships and distribution.
When closely examining Apple, the following trends emerge: 
The current Price to Earnings ratio of 35.04 is 1.03x higher than the industry average, indicating the stock is priced at a premium level according to the market sentiment.
The elevated Price to Book ratio of 49.67 relative to the industry average by 9.23x suggests company might be overvalued based on its book value.
The Price to Sales ratio of 8.53, which is 5.02x the industry average, suggests the stock could potentially be overvalued in relation to its sales performance compared to its peers.
The company has a higher Return on Equity (ROE) of 58.74%, which is 50.21% above the industry average. This suggests efficient use of equity to generate profits and demonstrates profitability and growth potential.
With higher Earnings Before Interest, Taxes, Depreciation, and Amortization (EBITDA) of $45.91 Billion, which is 117.72x above the industry average, the company demonstrates stronger profitability and robust cash flow generation.
The gross profit of $58.27 Billion is 73.76x above that of its industry, highlighting stronger profitability and higher earnings from its core operations.
The company's revenue growth of 3.95% is significantly below the industry average of 21.47%. This suggests a potential struggle in generating increased sales volume.

The debt-to-equity (D/E) ratio is an important measure to assess the financial structure and risk profile of a company.
Considering the debt-to-equity ratio in industry comparisons allows for a concise evaluation of a company's financial health and risk profile, aiding in informed decision-making.
By analyzing Apple in relation to its top 4 peers based on the Debt-to-Equity ratio, the following insights can be derived:
When compared to its top 4 peers, Apple has a moderate debt-to-equity ratio of 1.45.
This implies that the company maintains a balanced financial structure with a reasonable level of debt and an appropriate reliance on equity financing.
For Apple in the Technology Hardware, Storage & Peripherals industry, the PE, PB, and PS ratios are all high compared to its peers, indicating that the stock may be overvalued. On the other hand, Apple's high ROE, EBITDA, gross profit, and low revenue growth suggest strong profitability and operational efficiency relative to industry competitors.
This article was generated by Benzinga's automated content engine and reviewed by an editor.
Benzinga Rankings give you vital metrics on any stock – anytime.
© 2025 Benzinga.com. Benzinga does not provide investment advice. All rights reserved.
Trade confidently with insights and alerts from analyst ratings, free reports and breaking news that affects the stocks you care about."
