Ticker,Title,Published,Sentiment,Sentiment Score,Summary,Source,Source_domain,URL,Full_Article
AAPL,"Competitor Analysis: Evaluating Apple And Competitors In Technology Hardware, Storage & Peripherals Industry - Apple  ( NASDAQ:AAPL ) ",20250327,Somewhat-bullish,0.265092,"In today's rapidly changing and fiercely competitive business landscape, it is essential for investors and industry enthusiasts to thoroughly analyze companies. In this article, we will conduct a comprehensive industry comparison, evaluating Apple AAPL against its key competitors in the ...",Benzinga,www.benzinga.com,https://www.benzinga.com/insights/news/25/03/44516986/competitor-analysis-evaluating-apple-and-competitors-in-technology-hardware-storage-amp-peripherals,"In today's rapidly changing and fiercely competitive business landscape, it is essential for investors and industry enthusiasts to thoroughly analyze companies. In this article, we will conduct a comprehensive industry comparison, evaluating Apple AAPL against its key competitors in the Technology Hardware, Storage & Peripherals industry. By examining key financial metrics, market position, and growth prospects, we aim to provide valuable insights for investors and shed light on company's performance within the industry.
Apple is among the largest companies in the world, with a broad portfolio of hardware and software products targeted at consumers and businesses. Apple's iPhone makes up a majority of the firm sales, and Apple's other products like Mac, iPad, and Watch are designed around the iPhone as the focal point of an expansive software ecosystem. Apple has progressively worked to add new applications, like streaming video, subscription bundles, and augmented reality. The firm designs its own software and semiconductors while working with subcontractors like Foxconn and TSMC to build its products and chips. Slightly less than half of Apple's sales come directly through its flagship stores, with a majority of sales coming indirectly through partnerships and distribution.
Through a thorough examination of Apple, we can discern the following trends: 
At 35.16, the stock's Price to Earnings ratio significantly exceeds the industry average by 1.09x, suggesting a premium valuation relative to industry peers.
The elevated Price to Book ratio of 49.85 relative to the industry average by 9.64x suggests company might be overvalued based on its book value.
With a relatively high Price to Sales ratio of 8.57, which is 5.26x the industry average, the stock might be considered overvalued based on sales performance.
The Return on Equity (ROE) of 58.74% is 50.21% above the industry average, highlighting efficient use of equity to generate profits.
Compared to its industry, the company has higher Earnings Before Interest, Taxes, Depreciation, and Amortization (EBITDA) of $45.91 Billion, which is 117.72x above the industry average, indicating stronger profitability and robust cash flow generation.
Compared to its industry, the company has higher gross profit of $58.27 Billion, which indicates 73.76x above the industry average, indicating stronger profitability and higher earnings from its core operations.
The company's revenue growth of 3.95% is significantly below the industry average of 21.47%. This suggests a potential struggle in generating increased sales volume.

The debt-to-equity (D/E) ratio is a measure that indicates the level of debt a company has taken on relative to the value of its assets net of liabilities.
Considering the debt-to-equity ratio in industry comparisons allows for a concise evaluation of a company's financial health and risk profile, aiding in informed decision-making.
When comparing Apple with its top 4 peers based on the Debt-to-Equity ratio, the following insights can be observed:
Among its top 4 peers, Apple is placed in the middle with a moderate debt-to-equity ratio of 1.45.
This implies a balanced financial structure, with a reasonable proportion of debt and equity.
For Apple in the Technology Hardware, Storage & Peripherals industry, the PE, PB, and PS ratios are all high compared to its peers, indicating that the stock may be overvalued. On the other hand, Apple's high ROE, EBITDA, gross profit, and low revenue growth suggest strong profitability and operational efficiency relative to its industry competitors.
This article was generated by Benzinga's automated content engine and reviewed by an editor.
© 2025 Benzinga.com. Benzinga does not provide investment advice. All rights reserved.
Trade confidently with insights and alerts from analyst ratings, free reports and breaking news that affects the stocks you care about."
AAPL,Prediction: Apple Will Soar Over the Next 5 Years. Here's 1 Reason Why.,20250327,Neutral,0.070346,Investors aren't looking far enough down the road for its currently floundering AI efforts.,Motley Fool,www.fool.com,https://www.fool.com/investing/2025/03/27/prediction-apple-will-soar-over-the-next-5-years-h/,"Founded in 1993, The Motley Fool is a financial services company dedicated to making the world smarter, happier, and richer. The Motley Fool reaches millions of people every month through our premium investing solutions, free guidance and market analysis on Fool.com, top-rated podcasts, and non-profit The Motley Fool Foundation.
Founded in 1993, The Motley Fool is a financial services company dedicated to making the world smarter, happier, and richer. The Motley Fool reaches millions of people every month through our premium investing solutions, free guidance and market analysis on Fool.com, personal finance education, top-rated podcasts, and non-profit The Motley Fool Foundation.
Founded in 1993, The Motley Fool is a financial services company dedicated to making the world smarter, happier, and richer. The Motley Fool reaches millions of people every month through our premium investing solutions, free guidance and market analysis on Fool.com, top-rated podcasts, and non-profit The Motley Fool Foundation.
Founded in 1993, The Motley Fool is a financial services company dedicated to making the world smarter, happier, and richer. The Motley Fool reaches millions of people every month through our premium investing solutions, free guidance and market analysis on Fool.com, personal finance education, top-rated podcasts, and non-profit The Motley Fool Foundation.

       You're reading a free article with opinions that may differ
       from The Motley Fool's Premium Investing Services. Become a Motley Fool member today to
       get instant access to our top analyst recommendations, in-depth research, investing resources,
       and more. Learn More

Key Points
Investors aren't looking far enough down the road for its currently floundering AI efforts.
There's no denying it. Apple (AAPL 0.89%) was not only late to the artificial intelligence party, but it has struggled to catch up.
While the world was admittedly interested in Apple Intelligence's features unveiled in June of last year, demand for this tech -- as well as hardware that can handle it -- has been ho-hum. In fact, iPhone revenue fell during the quarter ending in December, while technology market research outfit IDC reports that unit sales of the iPhone slumped 4.1% year over year for the quarter in question. The company's AI-powered virtual assistant Siri has since been transferred to a new chief as well, after senior director Robby Walker called Apple's artificial intelligence results so far ""ugly and embarrassing.""
And yes, Apple shares have underperformed this year largely because of its disappointing artificial intelligence efforts.
Then again, perhaps the market was always expecting too much too soon. As UBS analyst David Vogt recently penned, investors shouldn't ""expect a significant improvement to Apple Intelligence over the next 12 months even with the upcoming [iPhone] 17 series in the fall of 2025,"" echoing timeline concerns voiced by Jefferies analyst Edison Lee and Wedbush's Dan Ives.
All three analysts, however, see AI-driven growth for Apple on the horizon once the company makes Apple Intelligence more marketable. In this vein, investment research house Imarc predicts the intelligent virtual assistant market is set to grow at an annualized pace of 26% through 2033. The market's likely to see this growth coming sooner rather than later, however, and simply sensing what awaits could be enough to (re)light a fire under this stock.
Analysts see it coming anyway. The analyst community's current 12-month consensus price target for Apple stands at $253.71 per share, up 15% from the stock's present price. Most of these analysts also rate Apple stock as at least a buy at this time.
The only missing ingredient is a catalyst convincing investors that Apple's AI efforts are back on track. The only problem? Once such a catalyst materializes, it may then be too late to step into a stake.
James Brumley has no position in any of the stocks mentioned. The Motley Fool has positions in and recommends Apple and Jefferies Financial Group. The Motley Fool has a disclosure policy.
Stocks Mentioned
*Average returns of all recommendations since inception. Cost basis and return based on previous market day close.
Related Articles

        Invest better with The Motley Fool. Get stock recommendations, portfolio guidance, and more from The Motley Fool's premium services.
      
Making the world smarter, happier, and richer.
© 1995 - 2025 The Motley Fool. All rights reserved.
Market data powered by Xignite and Polygon.io.
About The Motley Fool
Our Services
Around the Globe
Free Tools
Affiliates & Friends"
AAPL,How To Trade SPY With Initial Jobless Claims In Focus - NVIDIA  ( NASDAQ:NVDA ) ,20250327,Neutral,0.14591,"Good Morning Traders! In today's Market Clubhouse Morning Memo, we will discuss SPY, QQQ, AAPL, MSFT, NVDA, GOOGL, META, and TSLA. Our proprietary formula, exclusive to Market Clubhouse, dictates these price levels. This dynamic equation takes into account price, volume, and options flow.",Benzinga,www.benzinga.com,https://www.benzinga.com/markets/equities/25/03/44514895/how-to-trade-spy-with-initial-jobless-claims-in-focus,"Good Morning Traders! In today’s Market Clubhouse Morning Memo, we will discuss SPY, QQQ, AAPL, MSFT, NVDA, GOOGL, META, and TSLA.
Our proprietary formula, exclusive to Market Clubhouse, dictates these price levels. This dynamic equation takes into account price, volume, and options flow. These levels are updated every day and shared with all Clubhouse Members, prior to the opening of the market.
We recommend closely monitoring these stocks, and be prepared to leverage potential breakouts or reversals. As always, stay alert and ready to adjust your tactics based on the market’s pulse to optimize your trading gains. Now, let’s dive into the stock analysis:
SPDR S&P 500 ETF Trust (SPY)
Bulls currently have SPY trading near the critical pivot of 567.81. For a bullish scenario, a decisive move higher through 569.16 is crucial. Sustained buying above 569.98 could provide enough strength to target a rally towards 571.06. If buyers successfully defend this mark, expect continuation to the upside targeting 572.15, with an ambitious upside goal of 573.50. 
If SPY struggles and fails to maintain support at 567.81, bearish momentum would likely emerge, pushing prices down initially toward 566.46. Persistent selling pressure at this level could open the path to lower support zones at 565.38, followed by a critical test at 564.29. A heavy sell-off scenario today may extend prices down to our bearish objective at 563.23.
Invesco QQQ Trust Series 1 (QQQ)
QQQ is currently trading near the pivotal 481.73 level. For the bullish narrative to unfold, buyers must clearly establish dominance above this mark, followed by a firm move toward 483.95. Continued positive momentum should support an advance toward 486.10, potentially driving prices higher to test 487.69. If the bullish scenario plays out robustly, the day’s bullish target stands at 490.05. 
However, if buyers cannot maintain strength at 481.73, bears will likely seize control and press downward to test support at 479.03. Increasing bearish sentiment would likely prompt further selling toward 476.85, with subsequent downside continuation to a key support zone at 474.66. Should selling intensity increase, a drop towards our bearish goal at 471.33 becomes probable.
Apple Inc. (AAPL)
Apple is trading near the key reference point of 220.29. For bullish traders, securing support above this mark is essential, potentially driving price action toward 220.97. Persistent upward momentum may fuel further bullish expansion toward 221.66, ultimately challenging the higher resistance area marked at our bullish target of 222.24. 
Conversely, failure to defend the level of 220.29 may activate bearish sentiment, prompting an initial sell-off toward 219.19. If bearish momentum accelerates, anticipate a deeper decline to support around 218.08, and further selling could extend the downside pressure to test 216.70. A sustained bearish environment may ultimately guide the price to our bearish objective at 215.25.
Microsoft Corp. (MSFT)
Microsoft's current price action revolves closely around our benchmark at 389.29. For bullish sentiment to remain intact, bulls must decisively defend this area and push upward toward the next resistance level of 390.98. Holding this level through regular trading hours could stimulate additional upward movement toward 392.49, and continued bullish activity may reach our primary bullish target of 393.47. 
If bulls fail to support price at 389.29, bearish traders could aggressively target initial downside at 388.53. Should this support fail, expect additional bearish momentum driving prices lower towards 387.60, and potentially extending further downward to 386.09. Under persistent selling pressure, the day’s bearish target for Microsoft is set at 385.42.
NVIDIA Corporation NVDA
NVIDIA is actively trading near our significant pivot at 111.70. Bullish participants will need to convincingly push through initial resistance at 112.54, firmly establishing support there to encourage upside continuation toward 113.68. Increased bullish strength may support a rally up to 114.29, with a bullish scenario setting sights on the primary bullish objective of 115.15. 
On the flip side, a breakdown below the key support level of 111.70 would open the possibility of bearish acceleration toward 110.73. A continuation of selling pressure could drive prices down further, testing 109.86. Additional weakness may prompt bears to push the auction even lower towards 109.12, with today’s bearish target resting at 107.51.
Alphabet Inc Class A (GOOGL)
Alphabet is trading closely near our significant pivot of 165.41. Bulls must defend this area effectively, enabling upward momentum toward initial resistance at 167.04. Continued bullish sentiment could propel prices further upwards, aiming at our primary bullish target today set at 169.34. 
Alternatively, a failure to hold support at 165.41 could initiate bearish activity pushing prices down towards the next key support level at 163.79. If bearish pressure remains intense, expect further decline toward 161.79. Sustained downside momentum could ultimately guide price toward our bearish objective today at 160.36.
Meta Platforms Inc (META)
Meta is currently trading near the pivotal level of 604.50. Bulls will look to sustain support above this critical area, setting the stage for an initial bullish test at 609.30. Continued buying could further energize the auction towards 615.65, with a robust bullish environment potentially reaching our high bullish target today of 622.01. 
Should support at 604.50 fail during today’s session, bearish traders will likely drive prices downward toward the next key area at 598.17. If bearish sentiment intensifies, look for additional declines reaching 591.29. A deeper breakdown could eventually lead Meta's price action toward the bearish target today at 585.73.
Tesla Inc. (TSLA)
Tesla is presently trading close to our essential reference point at 275.07. Bulls will aim for decisive upward momentum targeting initial resistance at 278.11. Sustained bullish sentiment could carry prices higher toward our next key level at 279.43, potentially advancing further toward 281.32. If buyer interest is particularly robust today, the ultimate bullish objective is established at 283.95. 
Conversely, should the 275.07 support level fail, anticipate immediate bearish pressure toward 272.42. Continued selling intensity could further pressure prices downwards, testing lower at 269.48. If bearish momentum deepens significantly, a further decline toward today's bearish target of 266.83 is likely.
Final Word:
Today’s trading environment is heavily influenced by key economic data, beginning with Initial and Continuing Jobless Claims at 8:30 AM ET, released concurrently with Advance Goods Trade Balance and Retail Inventories for February, along with the significant Q4 GDP Annualized Price Index (Third Reading). Later at 10 AM ET, Pending Home Sales data for February arrives, providing additional market-moving potential. Additionally, watch for the Kansas City Fed Manufacturing Activity Index for March at 11:00 AM ET, followed by a crucial 7-Year Treasury Note Auction at 1 PM ET. 
Given the breadth and significance of today's economic releases, heightened volatility is anticipated across markets. Traders should approach today’s session prepared, emphasizing risk management and strategic patience, as data-driven price action could lead to considerable swings. Stay disciplined, and trade safe!
The Morning Memo is curated by RIPS, a pro trader with years of experience in equities, options, and futures trading. RIPS is at the heart of the exclusive Market Clubhouse community, offering his insights, expertise, and real-time mentorship.
Start your day with a live daily market analysis, a carefully selected watch list, early access to the Morning Memo, and exclusive Market Clubhouse price levels, providing precise support and resistance indicators. When you become a member of Market Clubhouse, you will gain early access to the Morning Memo, just like this one, every single day—hours before it’s published. You will also have access to a live stream with zero latency and screen sharing, enabling you to witness Rips executing his trades in real-time and sharing his exclusive trading plans, strategies, and live decision-making.
For a limited time during our special promotion, you can join RIPS and get a full access pass to Market Clubhouse for 7 full days for just $7. Check it out at https://marketclubhouse.club/7Days/ where you can trade live with him and tap into his wealth of knowledge and experience. You can also catch Rips on his live day trading streams every Monday-Friday at 8 am EST on the Market Clubhouse YouTube channel: https://www.youtube.com/@MarketClubhouse.
© 2025 Benzinga.com. Benzinga does not provide investment advice. All rights reserved.
Trade confidently with insights and alerts from analyst ratings, free reports and breaking news that affects the stocks you care about."
AAPL,Can the Tide Turn for 'Magnificent Seven' Stocks? ETFs in Focus,20250327,Somewhat-bullish,0.250291,Mag-7 stocks can gain winning momentum but remain clouded by tariff concerns. A strong business moat is the key strength of Mag-7 stocks. key strengths of the space ...,Zacks Commentary,www.zacks.com,https://www.zacks.com/stock/news/2436001/can-the-tide-turn-for-magnificent-seven-stocks-etfs-in-focus,
AAPL,"Is Nvidia the Next $5 Trillion Stock? Or Will Apple, Microsoft, Amazon, or Google Get There First?",20250327,Neutral,0.108227,"In the race to the coveted $5 trillion market capitalization, Nvidia ( NASDAQ: NVDA ) and Apple ( NASDAQ: AAPL ) have an early lead, but others are not far behind.*Stock prices used were the afternoon prices of March 24, 2025. The video was published on March 26, 2025.Continue reading ...",Motley Fool,www.fool.com,https://www.fool.com/investing/2025/03/27/is-nvidia-the-next-5-trillion-stock-or-will-apple/,"Founded in 1993, The Motley Fool is a financial services company dedicated to making the world smarter, happier, and richer. The Motley Fool reaches millions of people every month through our premium investing solutions, free guidance and market analysis on Fool.com, top-rated podcasts, and non-profit The Motley Fool Foundation.
Founded in 1993, The Motley Fool is a financial services company dedicated to making the world smarter, happier, and richer. The Motley Fool reaches millions of people every month through our premium investing solutions, free guidance and market analysis on Fool.com, personal finance education, top-rated podcasts, and non-profit The Motley Fool Foundation.
Founded in 1993, The Motley Fool is a financial services company dedicated to making the world smarter, happier, and richer. The Motley Fool reaches millions of people every month through our premium investing solutions, free guidance and market analysis on Fool.com, top-rated podcasts, and non-profit The Motley Fool Foundation.
Founded in 1993, The Motley Fool is a financial services company dedicated to making the world smarter, happier, and richer. The Motley Fool reaches millions of people every month through our premium investing solutions, free guidance and market analysis on Fool.com, personal finance education, top-rated podcasts, and non-profit The Motley Fool Foundation.

       You're reading a free article with opinions that may differ
       from The Motley Fool's Premium Investing Services. Become a Motley Fool member today to
       get instant access to our top analyst recommendations, in-depth research, investing resources,
       and more. Learn More

In the race to the coveted $5 trillion market capitalization, Nvidia (NVDA -1.42%) and Apple (AAPL 0.89%) have an early lead, but others are not far behind.
*Stock prices used were the afternoon prices of March 24, 2025. The video was published on March 26, 2025.
Suzanne Frey, an executive at Alphabet, is a member of The Motley Fool's board of directors. John Mackey, former CEO of Whole Foods Market, an Amazon subsidiary, is a member of The Motley Fool's board of directors. Parkev Tatevosian, CFA has positions in Alphabet and Apple. The Motley Fool has positions in and recommends Alphabet, Amazon, Apple, Microsoft, and Nvidia. The Motley Fool recommends the following options: long January 2026 $395 calls on Microsoft and short January 2026 $405 calls on Microsoft. The Motley Fool has a disclosure policy. Parkev Tatevosian is an affiliate of The Motley Fool and may be compensated for promoting its services. If you choose to subscribe through his link, he will earn some extra money that supports his channel. His opinions remain his own and are unaffected by The Motley Fool.
Stocks Mentioned
*Average returns of all recommendations since inception. Cost basis and return based on previous market day close.
Related Articles

        Invest better with The Motley Fool. Get stock recommendations, portfolio guidance, and more from The Motley Fool's premium services.
      
Making the world smarter, happier, and richer.
© 1995 - 2025 The Motley Fool. All rights reserved.
Market data powered by Xignite and Polygon.io.
About The Motley Fool
Our Services
Around the Globe
Free Tools
Affiliates & Friends"
